{
  "policy_id": "redact_prod_to_dev",
  "organization_id": "org_123",
  "project_id": "project_123",
  "environment_id": "env_123",
  "name": "Production to development redaction",
  "status": "active",
  "rules": [
    {
      "table_schema": "public",
      "table_name": "customers",
      "column_name": "email",
      "method": "hash_sha256"
    },
    {
      "table_schema": "public",
      "table_name": "customers",
      "column_name": "phone",
      "method": "null"
    }
  ],
  "created_at": "2026-05-18 12:00:00+00",
  "updated_at": "2026-05-18 12:00:00+00"
}
